{
    "$schema": "http://json-schema.org/draft-07/schema#",
    "type": "object",
    "properties": {
        "offering": {
            "type": "object",
            "properties": {
                "id": {"type": "string"},
                "currencyPairs": {
                    "type": "array",
                    "items": {
                        "type": "object",
                        "properties": {
                            "pair": {"type": "string"},
                            "payin": {
                                "type": "object",
                                "properties": {
                                    "kind": {"type": "string"},
                                    "amount": {"type": "string"},
                                    "paymentDetails": {"type": "object"}
                                },
                                "required": ["kind", "amount"]
                            },
                            "payout": {
                                "type": "object",
                                "properties": {
                                    "kind": {"type": "string"},
                                    "paymentDetails": {
                                        "type": "object",
                                        "properties": {
                                            "accountNumber": {"type": "string"},
                                            "reason": {"type": "string"}
                                        },
                                        "required": ["accountNumber", "reason"]
                                    }
                                },
                                "required": ["kind", "paymentDetails"]
                            },
                            "estimatedSettlementTime": {"type": "integer"}
                        },
                        "required": ["pair", "payin", "payout", "estimatedSettlementTime"]
                    }
                }
            },
            "required": ["id", "currencyPairs"]
        },
        "rfq": {
            "type": "object",
            "properties": {
                "metadata": {
                    "type": "object",
                    "properties": {
                        "from": {"type": "string"},
                        "to": {"type": "string"}
                    },
                    "required": ["from", "to"]
                },
                "data": {
                    "type": "object",
                    "properties": {
                        "offeringId": {"type": "string"},
                        "payin": {
                            "type": "object",
                            "properties": {
                                "kind": {"type": "string"},
                                "amount": {"type": "string"},
                                "paymentDetails": {"type": "object"}
                            },
                            "required": ["kind", "amount"]
                        },
                        "payout": {
                            "type": "object",
                            "properties": {
                                "kind": {"type": "string"},
                                "paymentDetails": {
                                    "type": "object",
                                    "properties": {
                                        "accountNumber": {"type": "string"},
                                        "reason": {"type": "string"}
                                    },
                                    "required": ["accountNumber", "reason"]
                                }
                            },
                            "required": ["kind", "paymentDetails"]
                        },
                        "claims": {"type": "array", "items": {"type": "string"}}
                    },
                    "required": ["offeringId", "payin", "payout", "claims"]
                }
            },
            "required": ["metadata", "data"]
        },
        "quote": {
            "type": "object",
            "properties": {
                "metadata": {
                    "type": "object",
                    "properties": {
                        "from": {"type": "string"},
                        "to": {"type": "string"},
                        "exchangeId": {"type": "string"}
                    },
                    "required": ["from", "to", "exchangeId"]
                },
                "data": {
                    "type": "object",
                    "properties": {
                        "expiresAt": {"type": "string", "format": "date-time"},
                        "payin": {
                            "type": "object",
                            "properties": {
                                "currencyCode": {"type": "string"},
                                "amount": {"type": "string"}
                            },
                            "required": ["currencyCode", "amount"]
                        },
                        "payout": {
                            "type": "object",
                            "properties": {
                                "currencyCode": {"type": "string"},
                                "amount": {"type": "string"}
                            },
                            "required": ["currencyCode", "amount"]
                        }
                    },
                    "required": ["expiresAt", "payin", "payout"]
                }
            },
            "required": ["metadata", "data"]
        },
        "accountCreated": {
            "type": "string",
            "format": "date-time"
        }
    },
    "required": ["offering", "rfq", "quote"]
}
