[
    {
        "offering": {
            "id": "offering-40511",
            "currencyPairs": [
                {
                    "pair": "USD/BANK_RANDOM",
                    "payin": {
                        "kind": "USD_LEDGER",
                        "amount": "350.00",
                        "paymentDetails": {}
                    },
                    "payout": {
                        "kind": "BANK_RANDOM",
                        "paymentDetails": {
                            "accountNumber": "0x5566778899",
                            "reason": ""
                        }
                    },
                    "estimatedSettlementTime": 15
                }
            ]
        },
        "rfq": {
            "metadata": {
                "from": "did:example:user-10015",
                "to": "did:example:pfi-10015"
            },
            "data": {
                "offeringId": "offering-40511",
                "payin": {
                    "kind": "USD_LEDGER",
                    "amount": "350.00",
                    "paymentDetails": {}
                },
                "payout": {
                    "kind": "BANK_RANDOM",
                    "paymentDetails": {
                        "accountNumber": "0x5566778899",
                        "reason": ""
                    }
                },
                "claims": ["signed-credential"]
            }
        },
        "quote": {
            "metadata": {
                "from": "did:example:pfi-10015",
                "to": "did:example:user-10015",
                "exchangeId": "exchange-40511"
            },
            "data": {
                "expiresAt": "2024-06-04T14:00:00Z",
                "payin": {
                    "currencyCode": "USD",
                    "amount": "350.00"
                },
                "payout": {
                    "currencyCode": "USD",
                    "amount": "345.00"
                }
            }
        },
        "accountCreated": "2024-05-01T00:00:00Z"
    },
    {
        "offering": {
            "id": "offering-40510",
            "currencyPairs": [
                {
                    "pair": "USD/BANK_RANDOM",
                    "payin": {
                        "kind": "USD_LEDGER",
                        "amount": "250.00",
                        "paymentDetails": {}
                    },
                    "payout": {
                        "kind": "BANK_RANDOM",
                        "paymentDetails": {
                            "accountNumber": "0x5566778899",
                            "reason": "Payment for services rendered"
                        }
                    },
                    "estimatedSettlementTime": 5
                }
            ]
        },
        "rfq": {
            "metadata": {
                "from": "did:example:user-10014",
                "to": "did:example:pfi-10014"
            },
            "data": {
                "offeringId": "offering-40510",
                "payin": {
                    "kind": "USD_LEDGER",
                    "amount": "250.00",
                    "paymentDetails": {}
                },
                "payout": {
                    "kind": "BANK_RANDOM",
                    "paymentDetails": {
                        "accountNumber": "0x5566778899",
                        "reason": "Payment for services rendered"
                    }
                },
                "claims": ["signed-credential"]
            }
        },
        "quote": {
            "metadata": {
                "from": "did:example:pfi-10014",
                "to": "did:example:user-10014",
                "exchangeId": "exchange-40510"
            },
            "data": {
                "expiresAt": "2024-06-03T14:00:00Z",
                "payin": {
                    "currencyCode": "USD",
                    "amount": "250.00"
                },
                "payout": {
                    "currencyCode": "USD",
                    "amount": "245.00"
                }
            }
        },
        "accountCreated": "2024-04-01T00:00:00Z"
    }
]
